{
  "version": "1.0.0",
  "metadata": {
    "title": "Smith Family Genogram",
    "description": "Three-generation example demonstrating unions, divorce, deceased members, twins, an adopted child, a pregnancy loss, and emotional relationships.",
    "author": "Example",
    "focusPersonId": "anna"
  },
  "people": [
    {
      "id": "gf",
      "name": "George Smith",
      "sex": "male",
      "birthDate": "1940-03-11",
      "deathDate": "2009-11-02",
      "deceased": true,
      "conditions": [
        { "name": "Heart disease", "category": "medical", "status": "active", "ageOfOnset": 62, "color": "#e57373" }
      ]
    },
    {
      "id": "gm",
      "name": "Margaret Smith",
      "sex": "female",
      "birthDate": "1943-07-22",
      "conditions": [
        { "name": "Depression", "category": "mental-health", "status": "in-remission", "color": "#64b5f6" }
      ]
    },
    {
      "id": "father",
      "name": "David Smith",
      "sex": "male",
      "birthDate": "1968-01-15",
      "conditions": [
        { "name": "Alcohol use", "category": "substance-use", "status": "active", "color": "#ffb74d" }
      ]
    },
    {
      "id": "mother",
      "name": "Susan Smith",
      "sex": "female",
      "birthDate": "1970-05-30"
    },
    {
      "id": "aunt",
      "name": "Linda Smith",
      "sex": "female",
      "birthDate": "1971-09-09"
    },
    {
      "id": "anna",
      "name": "Anna Smith",
      "sex": "female",
      "birthDate": "1995-02-20",
      "isProband": true,
      "birthOrder": 1,
      "twinGroupId": "t1",
      "twinType": "fraternal"
    },
    {
      "id": "ben",
      "name": "Ben Smith",
      "sex": "male",
      "birthDate": "1995-02-20",
      "birthOrder": 2,
      "twinGroupId": "t1",
      "twinType": "fraternal",
      "conditions": [
        { "name": "Asthma", "category": "medical", "status": "active", "color": "#81c784" }
      ]
    },
    {
      "id": "loss",
      "name": "Miscarriage",
      "sex": "unknown",
      "birthOrder": 3
    },
    {
      "id": "cousin",
      "name": "Ethan",
      "sex": "male",
      "birthDate": "2001-12-01"
    }
  ],
  "relationships": [
    {
      "id": "u-grandparents",
      "type": "union",
      "partnerIds": ["gf", "gm"],
      "unionType": "married",
      "status": "widowed",
      "startDate": "1965-06-12"
    },
    {
      "id": "u-parents",
      "type": "union",
      "partnerIds": ["father", "mother"],
      "unionType": "married",
      "status": "divorced",
      "startDate": "1992-08-01",
      "endDate": "2008-03-15"
    },
    {
      "id": "pc-father",
      "type": "parent-child",
      "childId": "father",
      "unionId": "u-grandparents",
      "biological": "biological"
    },
    {
      "id": "pc-aunt",
      "type": "parent-child",
      "childId": "aunt",
      "unionId": "u-grandparents",
      "biological": "biological"
    },
    {
      "id": "pc-anna",
      "type": "parent-child",
      "childId": "anna",
      "unionId": "u-parents",
      "biological": "biological"
    },
    {
      "id": "pc-ben",
      "type": "parent-child",
      "childId": "ben",
      "unionId": "u-parents",
      "biological": "biological"
    },
    {
      "id": "pc-loss",
      "type": "parent-child",
      "childId": "loss",
      "unionId": "u-parents",
      "biological": "biological",
      "pregnancyOutcome": "miscarriage"
    },
    {
      "id": "pc-cousin",
      "type": "parent-child",
      "childId": "cousin",
      "parentIds": ["aunt"],
      "biological": "adopted"
    },
    {
      "id": "e-anna-mother",
      "type": "emotional",
      "personIds": ["anna", "mother"],
      "bond": "close"
    },
    {
      "id": "e-anna-father",
      "type": "emotional",
      "personIds": ["father", "anna"],
      "bond": "conflict"
    },
    {
      "id": "e-anna-ben",
      "type": "emotional",
      "personIds": ["anna", "ben"],
      "bond": "very-close"
    }
  ]
}
